cu_name,address1,city,state,zipcode,new_name,cu_name1ST BERGEN FEDERAL CREDIT UNION,241 Moore Street,Hackensack,New Jersey,7601,,1ST BERGEN FEDERAL CREDIT UNION1ST CHOICE CREDIT UNION,315 Auburn Avenue NE,Atlanta,Georgia,30303,,1ST CHOICE CREDIT UNION1ST FINANCIAL FEDERAL CREDIT UNION,1232 Wentzville Parkway,Wentzville,Missouri,63385,,1ST FINANCIAL FEDERAL CREDIT UNIONADVANTAGE ONE CREDIT UNION,23670 Telegraph Rd,Brownstown,Michigan,48134,,ADVANTAGE ONE CREDIT UNIONADVIA CREDIT UNION,550 S Riverview Dr,Parchment,Michigan,49004,,ADVIA CREDIT UNIONALABAMA CREDIT UNION,909 Anna Ave,Tuscaloosa,Alabama,35401,,ALABAMA CREDIT UNIONALLIANCE CREDIT UNION,1280 S Highway Dr,Fenton,Missouri,63026,,ALLIANCE CREDIT UNIONALPENA COMMUNITY CREDIT UNION,710 West Miller Street,Alpena,Michigan,49707,,ALPENA COMMUNITY CREDIT UNIONALTERNATIVES FEDERAL CREDIT UNION,125 North Fulton Street,Ithaca,New York,14850,,ALTERNATIVES FEDERAL CREDIT UNIONAMERICAN PARTNERS FEDERAL CREDIT UNION,PO Box 1198,Reidsville,North Carolina,27323,,AMERICAN PARTNERS FEDERAL CREDIT UNIONANECA FEDERAL CREDIT UNION,4361 Youree Dr.,Shreveport,Louisiana,71105,,ANECA FEDERAL CREDIT UNIONAPPALACHIAN COMMUNITY FCU,5034 Bobby Hicks Hwy Suite 2,Gray,Tennessee,37615,,APPALACHIAN COMMUNITY FCUARBUCKLE FEDERAL CREDIT UNION,317 S. Broadway,Ada,Oklahoma,74820,,ARBUCKLE FEDERAL CREDIT UNIONARSENAL CREDIT UNION,3780 Vogel Road,Arnold,Missouri,63010,,ARSENAL CREDIT UNIONASCENTRA CREDIT UNION,PO BOX 1107,Bettendorf,Iowa,52772,,ASCENTRA CREDIT UNIONASI FEDERAL CREDIT UNION,5508 Citrus Boulevard,Harahan,Louisiana,70123,,ASI FEDERAL CREDIT UNIONASSEMBLIES OF GOD CREDIT UNION,1535 North Campbell Avenue,Springfield,Missouri,65803,,ASSEMBLIES OF GOD CREDIT UNIONASSOCIATED CREDIT UNION OF TEXAS,P.O. Box 9004,League City,Texas,77574,,ASSOCIATED CREDIT UNION OF TEXASATCHISON VILLAGE CREDIT UNION,270 A Curry,Richmond,California,94801,,ATCHISON VILLAGE CREDIT UNIONATHOL CREDIT UNION,513 Main St.  P.O. Box 389,Athol,Massachusetts,1331,,ATHOL CREDIT UNIONAWAKON FEDERAL CREDIT UNION,20855 Washington Ave PO Box 420,Onaway,Michigan,49765,,AWAKON FEDERAL CREDIT UNIONBAY FEDERAL CREDIT UNION,3333 Clares Street,Capitola,California,95010,,BAY FEDERAL CREDIT UNIONBIG ISLAND FEDERAL CREDIT UNION,66 LONO STREET,HILO,Hawaii,96720,,BIG ISLAND FEDERAL CREDIT UNIONBORDER FEDERAL CREDIT UNION,2211 N. BEDELL AVE.,DEL RIO,Texas,78840,,BORDER FEDERAL CREDIT UNIONBRADLEY INITIATIVE CREDIT UNION,1075 Blythe Avenue SE,Cleveland,Tennessee,37311,,BREWERY CREDIT UNIONBREWERY CREDIT UNION,"1351 N.DR.MARTIN LUTHER KING, JR.DR.",MILWAUKEE,Wisconsin,53212,,BROOKLYN COOPERATIVE FEDERAL CREDIT UNIONBROOKLYN COOPERATIVE FEDERAL CREDIT UNION,1474 Myrtle Avenue,Brooklyn,New York,11237,,BUFFALO COOPERATIVE FEDERAL CREDIT UNIONBUFFALO COOPERATIVE FEDERAL CREDIT UNION,816  Elmwood Ave  Rear,Buffalo,New York,14222,,CALCOE FEDERAL CREDIT UNIONCALCOE FEDERAL CREDIT UNION,1209 North 16th Avenue,Yakima,Washington,98902,,CAPROCK FEDERAL CREDIIT UNIONCAPROCK FEDERAL CREDIIT UNION,709 N 1st Street,Lamesa,Texas,79331,,CAROLINA FOOTHILLS FCUCAROLINA FOOTHILLS FCU,520 North Church St,Spartanburg,South Carolina,29303,,CARTER FEDERAL CREDIT UNIONCAROLINA POSTAL CREDIT UNION,3601 Mulberry Church Road,Charlotte,North Carolina,28208,,CASE CREDIT UNIONCARTER FEDERAL CREDIT UNION,133 S. Main Street,Springhill,Louisiana,71075,,CENCAP FEDERAL CREDIT UNIONCASCADE FOREST PRODUCTS CREDIT UNION,702 Jefferson Street,Vancouver,Washington,98660,,CENTRAL SUNBELT FCUCASE CREDIT UNION,4316 S Pennsylvania,Lansing,Michigan,48910,,CENTRIC FEDERAL CREDIT UNIONCENCAP FEDERAL CREDIT UNION,443 Franklin Avenue,Hartford,Connecticut,6114,,CHADRON FEDERAL CREDIT UNIONCENTRAL SUNBELT FCU,1506 Congress St,Laurel,Mississippi,39440,,CHICAGO MUNICIPAL EMPLOYEES CREDIT UNIONCENTRIC FEDERAL CREDIT UNION,1091 Thomas Road,West Monroe,Louisiana,71292,,CHOCTAW FEDERAL CREDIT UNIONCHADRON FEDERAL CREDIT UNION,126 E 3rd St,Chadron,Nebraska,69337,,CITY CENTER CREDIT UNIONCHICAGO MUNICIPAL EMPLOYEES CREDIT UNION,18 S Michigan Ave. Suite 1000,Chicago,Illinois,60603,,CLINCHFIELD FEDERAL CREDIT UNIONCHOCTAW FEDERAL CREDIT UNION,P.O. Box 6284,Choctaw,Mississippi,39350,,CO FEDERAL CREDIT UNIONCITY CENTER CREDIT UNION,345 West 100 South,Provo,Utah,84601,,COBBLESTONE COUNTRY FEDERAL CREDIT UNIONCLINCHFIELD FEDERAL CREDIT UNION,1038 N. Main Ave.,Erwin,Tennessee,37650,,COLQUITT COUNTY TEACHERS FEDERAL CREDIT UNIONCO FEDERAL CREDIT UNION,117 Spring Street,Charleston,South Carolina,29403,,COMMODORE PERRY FEDERAL CREDIT UNIONCOBBLESTONE COUNTRY FEDERAL CREDIT UNION,299 West Ave,Albion,New York,14411,,COMMUNITY 1ST CREDIT UNIONCOLQUITT COUNTY TEACHERS FEDERAL CREDIT UNION,720 28th Avenue SE,Moultrie,Georgia,31768,,COMMUNITY CREDIT UNION OF FLORIDACOMMODORE PERRY FEDERAL CREDIT UNION,1016 S. St. Rte. 19,Oak Harbor,Ohio,43449,,COMMUNITY CREDIT UNION OF SOUTHERN HUMBOLDTCOMMUNITY 1ST CREDIT UNION,235 Richmond Ave.,Ottumwa,Iowa,52502,,COMMUNITY FINANCIAL CREDIT UNIONCOMMUNITY CREDIT UNION OF FLORIDA,1030 S US Highway 1,Rockledge,Florida,32955,,COMMUNITY FIRST GUAM FEDERAL CREDIT UNIONCOMMUNITY CREDIT UNION OF SOUTHERN HUMBOLDT,757 Redwood Drive,Garberville,California,95542,,COMMUNITY PLUS FEDERAL CREDIT UNIONCOMMUNITY FINANCIAL CREDIT UNION,815 W Tampa,Springfield,Missouri,65802,,COMMUNITY PROMISE FCUCOMMUNITY FIRST GUAM FEDERAL CREDIT UNION,"238 AFC Flores Street, Suite 102",Hagatna,Guam,96910,,COMMUNITY SOUTH CREDIT UNIONCOMMUNITY PLUS FEDERAL CREDIT UNION,526 E Champaign Ave  PO Box 255,Rantoul,Illinois,61866,,COMMUNITYWORKS FEDERAL CREDIT UNIONCOMMUNITY PROMISE FCU,1313 Portage St  PO Box 3337,Kalamazoo,Michigan,49003,,COOPERATIVE CENTER FEDERAL CREDIT UNIONCOMMUNITY SOUTH CREDIT UNION,1044 Highway 90,Chipley,Florida,32428,,CORE CREDIT UNIONCOMMUNITYWORKS FEDERAL CREDIT UNION,115 W. Antrim Drive,Greenville,South Carolina,29607,,COVANTAGE CREDIT UNIONCOOPERATIVE CENTER FEDERAL CREDIT UNION,2001 Ashby Avenue,Berkeley,California,94703,,CREDIT UNION ONECORE CREDIT UNION,PO Box 1987,Statesboro,Georgia,30459,,CU COMMUNITY CREDIT UNIONCOVANTAGE CREDIT UNION,PO Box 107  723 6th Avenue,Antigo,Wisconsin,54409,,CUTTING EDGE FEDERAL CREDIT UNIONCREDIT UNION ONE,400 E. Nine Mile Road,Ferndale,Michigan,48820,,DC CREDIT UNIONCU COMMUNITY CREDIT UNION,818 North Benton,Springfield,Missouri,65802,,DEMOCRACY FCUCUTTING EDGE FEDERAL CREDIT UNION,4620 SE International Way Ste. 105,Milwaukie,Oregon,97222,,DEMOPOLIS FEDERAL CREDIT UNIONDEMOCRACY FCU,"400 N. Columbus St., Suite 300",Alexandria,Virginia,22314,,DESERT COMMUNITIES FCUDEMOPOLIS FEDERAL CREDIT UNION,106 East Washington Street  PO Box 727,Demopolis,Alabama,36732,,DIAMOND LAKES FEDERAL CREDIT UNIONDESERT COMMUNITIES FCU,305 D Street,Needles,California,92363,,DRESSER ALEXANDRIA FCUDIAMOND LAKES FEDERAL CREDIT UNION,7333 Highway 270,Malvern,Arkansas,72104,,DUPACO COMMUNITY CREDIT UNIONDISTRICT GOVERNMENT EMPLOYEES FEDERAL CREDIT UNION,2000 14th Street NW  2nd Floor,Washington,District of Columbia,20009,,DUPONT COMMUNITY CREDIT UNIONDRESSER ALEXANDRIA FCU,8034 Shreveport Hwy,Pineville,Louisiana,71360,,EAGLE ONE FEDERAL CREDIT UNIONDUPACO COMMUNITY CREDIT UNION,3999 Pennsylvania Avenue,Dubuque,Iowa,52002,,EAST END FOOD COOP FCUDUPONT COMMUNITY CREDIT UNION,P.O. Box 1365  140 Lucy Lane,Waynesboro,Virginia,22980,,EAST RIVER DEVELOPMENT ALLIANCE FEDERAL CREDIT UNIONEAGLE ONE FEDERAL CREDIT UNION,3301 Philadelphia Pike,Claymont,Delaware,19703,,ELGA CREDIT UNIONEAST END FOOD COOP FCU,7526 Meade St.,Pittsburgh,Pennsylvania,15208,,EMPOWER FCUEAST RIVER DEVELOPMENT ALLIANCE FEDERAL CREDIT UNION,13-03B 40th Avenue  Ground Floor,Long Island City,New York,11101,,ENTERTAINMENT INDUSTRIES FCUELGA CREDIT UNION,2305 S Center Rd,Burton,Michigan,48519,,ENVISION CREDIT UNIONEMPOWER FCU,401 N Salina St,Syracuse,New York,13203,,EPISCOPAL COMMUNITY FEDERAL CREDIT UNIONENTERTAINMENT INDUSTRIES FCU,550 Madison Ave.,New York,New York,10022,,EQUISHARE CREDIT UNIONENVISION CREDIT UNION,PO Box 5198,Tallahassee,Florida,32314,,ESSENTIAL FEDERAL CREDIT UNIONEPISCOPAL COMMUNITY FEDERAL CREDIT UNION,840 ECHO PARK AVE.,LOS ANGELES,California,90026,,EVERYONES FEDERAL CREDIT UNIONEQUISHARE CREDIT UNION,9100 W Central,Wichita,Kansas,67212,,EXPRESS CREDIT UNIONESSENTIAL FEDERAL CREDIT UNION,PO Box 783,Plaquemien,Louisiana,70765,,FAIRWINDS CREDIT UNIONEVERYONES FEDERAL CREDIT UNION,PO Box 1023   505 E. ROUTE 66 BLVD.,Tucumcari,New Mexico,88401,,FAITH COMMUNITY UNITED CREDIT UNIONEXPRESS CREDIT UNION,"1930 6th Ave S, Ste 104",Seattle,Washington,98134,,FERGUSON FEDERAL CREDIT UNIONFAIRWINDS CREDIT UNION,"135 W Central Blvd, Suite 1220",Orlando,Florida,32801,,FIDELIS FEDERAL CREDIT UNIONFAITH COMMUNITY UNITED CREDIT UNION,3550 East 93rd Street,Cleveland,Ohio,44105,,FIRST AMERICAN CREDIT UNIONFERGUSON FEDERAL CREDIT UNION,577 NA Sandifer Highway,Monticello,Mississippi,39654,,FIRST FINANCIAL CREDIT UNIONFIDELIS FEDERAL CREDIT UNION,448 West 152nd Street,NEW YORK,New York,10031,,FIRST IMPERIAL CREDIT UNIONFIRST AMERICAN CREDIT UNION,1001 N. Pinal Avenue,Casa Grande,Arizona,85122,,FIRST LIGHT FEDERAL CREDIT UNIONFIRST FINANCIAL CREDIT UNION,601 Tijeras Ave NW,Albuquerque,New Mexico,87102,,FIRST RELIANCE FEDERAL CREDIT UNIONFIRST IMPERIAL CREDIT UNION,1602 W Main St,El Centro,California,92243,,FIRST UNITY FEDERAL CREDIT UNIONFIRST LIGHT FEDERAL CREDIT UNION,9993 KENWORTHY,EL PASO,Texas,79924,,FIVE STAR CREDIT UNIONFIRST RELIANCE FEDERAL CREDIT UNION,205 Collins Industrial Blvd.,Athens,Georgia,30601,,FLORIDA A&M UNIVERSITY FEDERAL CREDIT UNIONFIRST UNITY FEDERAL CREDIT UNION,122 5th Ave   Suite B,McComb,Mississippi,39648,,FLORIDA CREDIT UNIONFIVE STAR CREDIT UNION,411 NORTH FOSTER STREET,DOTHAN,Alabama,36303,,FLORIDA STATE UNIVERSITY CREDIT UNIONFLORIDA A&M UNIVERSITY FEDERAL CREDIT UNION,1610 South Monroe Street,Tallahassee,Florida,32301,,FRANKENMUTH CREDIT UNIONFLORIDA CREDIT UNION,PO Box 5549,Gainesville,Florida,32627,,FREEDOM FIRST FEDERAL CREDIT UNIONFLORIDA STATE UNIVERSITY CREDIT UNION,2806 Sharer Rd.,Tallahassee,Florida,32312,,GECUFRANKENMUTH CREDIT UNION,PO Box 209,Frankenmuth,Michigan,48734,,GENESEE CO-OP FEDERAL CREDIT UNIONFREEDOM FIRST FEDERAL CREDIT UNION,5240 Valleypark Dr,Roanoke,Virginia,24019,,GOLDENWEST CREDIT UNIONGECU,1225 airway,el paso,Texas,79925,,GOVERNMENT PRINTING OFFICE FEDERAL CREDIT UNIONGENESEE CO-OP FEDERAL CREDIT UNION,395 Gregory St,Rochester,New York,14620,,GREATER KINSTON CREDIT UNIONGOLDENWEST CREDIT UNION,5025 S. Adams,Ogden,Utah,84403,,GREYLOCK FEDERAL CREDIT UNIONGOVERNMENT PRINTING OFFICE FEDERAL CREDIT UNION,po box 77119,washington,District of Columbia,20013,,GTE FEDERAL CREDIT UNIONGREATER KINSTON CREDIT UNION,901 N. Queen St.,Kinston,North Carolina,28501,,GUADALUPE CENTERS FEDERAL CREDIT UNIONGREYLOCK FEDERAL CREDIT UNION,150 West Street,Pittsfield,Massachusetts,1201,,GUADALUPE CREDIT UNIONGTE FEDERAL CREDIT UNION,PO Box 10550,Tampa,Florida,33679,,GUARDIANS CREDIT UNIONGUADALUPE CENTERS FEDERAL CREDIT UNION,1015 Avenida Cesar Chavez,Kansas City,Missouri,64108,,GULF COAST COMMUNITY FCUGUADALUPE CREDIT UNION,3601 Mimbres Lane,Santa Fe,New Mexico,87507,,HALIFAX COUNTY COMMUNITY FEDERAL CREDIT UNIONGUARDIANS CREDIT UNION,3469 Summit Boulevard,West Palm Beach,Florida,33406,,HARBORSTONE CREDIT UNIONGULF COAST COMMUNITY FCU,12364 Highway 49,Gulfport,Mississippi,39503,,HAWAII CENTRAL FEDERAL CREDIT UNIONHALIFAX COUNTY COMMUNITY FEDERAL CREDIT UNION,1176 Huell Matthews Hwy  PO Box 799,South Boston,Virginia,24592,,HAWAII FEDERAL CREDIT UNIONHARBORSTONE CREDIT UNION,9611 Gravelly Lake Drive SW,Lakewood,Washington,98499,,HAWAII FIRST FCUHAWAII CENTRAL FEDERAL CREDIT UNION,681 S. King Street,Honolulu,Hawaii,96813,,HEALTH FACILITIES FCUHAWAII FEDERAL CREDIT UNION,1244 Kaumualii Street,Honolulu,Hawaii,96817,,HILL DISTRICT FEDERAL CREDIT UNIONHAWAII FIRST FCU,67-1187 Mamalahoa Hwy,Kamuela,Hawaii,96743,,HOLY ROSARY CREDIT UNIONHEALTH FACILITIES FCU,501 S Irby St,Florence,South Carolina,29501,,HOPE FEDERAL CREDIT UNIONHILL DISTRICT FEDERAL CREDIT UNION,2021 Centre Avenue,Pittsburgh,Pennsylvania,15219,,HOPESOUTH FCUHOLY ROSARY CREDIT UNION,533 Campbell,Kansas City,Missouri,64106,,HORIZON CREDIT UNIONHOPE FEDERAL CREDIT UNION,4 Old River Place,Jackson,Mississippi,39202,,HORIZON CREDIT UNIONHOPESOUTH FCU,807 W Greenwood St,Abbeville,South Carolina,29620,,HOUSTON METROPOLITAN FEDERAL CREDIT UNIONHORIZON CREDIT UNION,301 North Missouri Street,Macon,Missouri,63552,,I.H. MISSISSIPPI VALLEY CREDIT UNIONHORIZON CREDIT UNION,408 Clay Street,Kingsport,Tennessee,37660,,INDUSTRIAL CU OF WHATCOM COUNTYHOUSTON METROPOLITAN FEDERAL CREDIT UNION,608 E Tidwell Rd,Houston,Texas,77022,,INNOVATIONS FCUI.H. MISSISSIPPI VALLEY CREDIT UNION,2121 47th St,Moline,Illinois,61265,,ISRAEL METHCOMM FCUINDUSTRIAL CU OF WHATCOM COUNTY,1100 N State Street,Bellingham,Washington,98225,,JEFFERSON FINANCIAL FEDERAL CREDIT UNIONINNOVATIONS FCU,910 Thomas Drive,Panama City,Florida,32408,,JETSTREAM FEDERAL CREDIT UNIONISRAEL METHCOMM FCU,P.O. Box 19144,Chicago,Illinois,60619,,KERR COUNTY FEDERAL CREDIT UNIONJEFFERSON FINANCIAL FEDERAL CREDIT UNION,7701 Airline Dr,Metairie,Louisiana,70003,,KINECTA FEDERAL CREDIT UNIONJETSTREAM FEDERAL CREDIT UNION,P.O. Box 5487,Miami Lakes,Florida,33014,,KOOTENAI VALLEY FEDERAL CREDIT UNIONKERR COUNTY FEDERAL CREDIT UNION,Kerr County Federal Credit Union  3700 Memorial Blvd,Kerrville,Texas,78028,,LAFAYETTE SCHOOLS CREDIT UNIONKINECTA FEDERAL CREDIT UNION,1440 Rosecrans Ave,Manhattan Beach,California,90266,,LAKE TRUST CREDIT UNIONKOOTENAI VALLEY FEDERAL CREDIT UNION,"P.O. Box 636,",Libby,Montana,59923,,LAKOTA FEDERAL CREDIT UNIONLAFAYETTE SCHOOLS CREDIT UNION,515 Guilbeau Rd,Lafayette,Louisiana,70506,,LATAH FEDERAL CREDIT UNIONLAKE TRUST CREDIT UNION,4605 S. Old US Highway 23,Brighton,Michigan,48114,,LATINO COMMUNITY CREDIT UNIONLAKOTA FEDERAL CREDIT UNION,"BIA 2 Main St  Lakota Trade Center, Suite 103",Kyle,South Dakota,57752,,LES FEDERAL CREDIT UNIONLATAH FEDERAL CREDIT UNION,912 S Washington Street,Moscow,Idaho,83843,,LEWIS CLARK CREDIT UNIONLATINO COMMUNITY CREDIT UNION,100 W. Morgan Street,Durham,North Carolina,27701,,LIGHTHOUSE COMMUNITYLES FEDERAL CREDIT UNION,950 N 22nd Street  Suite C,Baton Rouge,Louisiana,70802,,LOCAL GOVERNMENT FEDERAL CREDIT UNIONLEWIS CLARK CREDIT UNION,1626 17th St,Lewiston,Idaho,83501,,LOUISIANA FEDERAL CREDIT UNIONLOCAL GOVERNMENT FEDERAL CREDIT UNION,323 West Jones Street  Suite 600,Raleigh,North Carolina,27603,,LOWER EAST SIDE PEOPLES FEDERAL CREDIT UNIONLOUISIANA FEDERAL CREDIT UNION,805 Robin Street,LaPlace,Louisiana,70068,,LOWER VALLEY CREDIT UNIONLOWER EAST SIDE PEOPLES FEDERAL CREDIT UNION,37 Avenue B,New York,New York,10009,,MAC FEDERAL CREDIT UNIONLOWER VALLEY CREDIT UNION,900 Yakima Valley Highway,Sunnyside,Washington,98944,,MAGNIFY CREDIT UNIONMAC FEDERAL CREDIT UNION,3700 Santiago,Fort Wainwright,Alaska,99703,,MAGNOLIA FEDERAL CREDIT UNIONMAGNIFY CREDIT UNION,PO Box 427,Mulberry,Florida,33860,,MANATEE COMMUNITY FEDERAL CREDIT UNIONMAGNOLIA FEDERAL CREDIT UNION,240 Briarwood Drive,Jackson,Mississippi,39206,,MARISOL FEDERAL CREDIT UNIONMANATEE COMMUNITY FEDERAL CREDIT UNION,604 13th Ave. East,Bradenton,Florida,34208,,MAZUMA CREDIT UNIONMARISOL FEDERAL CREDIT UNION,721 N. Third Street  PO BOX 20525,Phoenix,Arizona,85004,,MCCONE COUNTY FEDERAL CREDIT UNIONMAZUMA CREDIT UNION,7260 West 135th Street,Overland Park,Kansas,66223,,MECU OF BALTIMORE INC.MCCONE COUNTY FEDERAL CREDIT UNION,PO Box 79,Circle,Montana,59215,,"MEMBERS """"FIRST"""" CREDIT UNION"MECU OF BALTIMORE INC.,7 East  Redwood Street,Baltimore,Maryland,21202,,MEMBERS EXCHANGE CREDIT UNION"MEMBERS """"FIRST"""" CREDIT UNION",1201 N. 24th St,Quincy,Illinois,62301,,MENDO LAKE CREDIT UNIONMEMBERS EXCHANGE CREDIT UNION,107 Marketridge Drive,Ridgeland,Mississippi,39157,,MIAMI POSTAL SERVICE CREDIT UNIONMENDO LAKE CREDIT UNION,526 S. State Street,Ukiah,California,95482,,MID MINNESOTA FEDERAL CREDIT UNIONMIAMI POSTAL SERVICE CREDIT UNION,2190 NW 72nd Ave,Miami,Florida,33122,,MID OREGON FEDERAL CREDIT UNIONMID MINNESOTA FEDERAL CREDIT UNION,13283 Isle Dr,Baxter,Minnesota,56425,,MISSOULA FEDERAL CREDIT UNIONMID OREGON FEDERAL CREDIT UNION,PO Box 6749,Bend,Oregon,97708,,MOLOKAI COMMUNITY FEDERAL CREDIT UNIONMISSOULA FEDERAL CREDIT UNION,3600 Brooks,Missoula,Montana,59801,,MOUNTAIN STAR FEDERAL CREDIT UNIONMOLOKAI COMMUNITY FEDERAL CREDIT UNION,P.O. Box 1888  135 Puali Place,Kaunakakai,Hawaii,96748,,MOUNTAIN WEST FCUMOUNTAIN STAR FEDERAL CREDIT UNION,2229 E Yandell,El Paso,Texas,79903,,MT. ZION FEDERAL CREDIT UNIONMOUNTAIN WEST FCU,400 E Park,Butte,Montana,59701,,NATCO CREDIT UNIONMT. ZION FEDERAL CREDIT UNION,3549 N. Boulevard Place,Indianapolis,Indiana,46208,,NEIGHBORHOOD TRUST FEDERAL CREDIT UNIONNATCO CREDIT UNION,PO Box 817,Richmond,Indiana,47375,,NEW COMMUNITY FEDERAL CREDIT UNIONNEIGHBORHOOD TRUST FEDERAL CREDIT UNION,1112 St Nicholas Ave,New York,New York,10032,,NEW COVENANT DOMINION FEDERAL CREDIT UNIONNEW COMMUNITY FEDERAL CREDIT UNION,274 South Orange Avenue,Newark,New Jersey,7103,,NEW HORIZON FEDERAL CREDIT UNIONNEW COVENANT DOMINION FEDERAL CREDIT UNION,1185 Boston Road,Bronx,New York,10456,,NEW YORK UNIVERSITY FCUNEW HORIZON FEDERAL CREDIT UNION,180 2nd St SW,Barberton,Ohio,44203,,NEWPORT NEWS SHIPBUILDING EMPLOYEES CREDIT UNION D/B/A BAYPORT CREDIT UNIONNEW YORK UNIVERSITY FCU,"726 Broadway, Suite 110",New York,New York,10003,,NEWRIZONS FEDERAL CREDIT UNIONNEWPORT NEWS SHIPBUILDING EMPLOYEES CREDIT UNION D/B/A BAYPORT CREDIT UNION,1 BayPort Way Ste 350,Newport News,Virginia,23606,,NORSTATE FEDERAL CREDIT UNIONNEWRIZONS FEDERAL CREDIT UNION,120 Firman Street,Hoquiam,Washington,98550,,NORTH CAROLINA COMMUNITY FEDERAL CREDIT UNIONNORSTATE FEDERAL CREDIT UNION,78 Fox St,Madawaska,Maine,4756,,NORTH COAST CREDIT UNIONNORTH CAROLINA COMMUNITY FEDERAL CREDIT UNION,po drawer 10589,goldsboro,North Carolina,27534,,NORTH COAST CREDIT UNIONNORTH COAST CREDIT UNION,1100 Dupont Street,Bellingham,Washington,98225,,NORTH JERSEY FEDERAL CREDIT UNIONNORTH COAST CREDIT UNION,22735 Lorain Road,Fairview Park,Ohio,44126,,NORTH SIDE COMMUNITY FEDERAL CREDIT UNIONNORTH JERSEY FEDERAL CREDIT UNION,711 Union Blvd,Totowa,New Jersey,7512,,NORTHEAST COMMUNITY CREDIT UNIONNORTH SIDE COMMUNITY FEDERAL CREDIT UNION,1011 W. Lawrence,Chicago,Illinois,60640,,NORTHEAST COMMUNITY FEDERAL CREDIT UNIONNORTHEAST COMMUNITY CREDIT UNION,980 Jason Witten Way,Elizabethton,Tennessee,37643,,NORTHEAST REGIONAL CREDIT UNIONNORTHEAST COMMUNITY FEDERAL CREDIT UNION,683 Clay Street,San Francisco,California,94111,,NORTHERN EAGLE FEDERAL CREDIT UNIONNORTHEAST REGIONAL CREDIT UNION,514 BROADWAY,HANNIBAL,Missouri,63401,,NORTHERN NEW MEXICO SCHOOL EMPLOYEES FEDERAL CREDIT UNIONNORTHERN EAGLE FEDERAL CREDIT UNION,5344 Lakeshore Drive,Nett Lake,Minnesota,55772,,NORTHWOODS COMMUNITY CREDIT UNIONNORTHERN NEW MEXICO SCHOOL EMPLOYEES FEDERAL CREDIT UNION,614 Alta Vista St,Santa Fe,New Mexico,87505,,NOVANORTHWOODS COMMUNITY CREDIT UNION,1224 4th Ave S,Park Falls,Wisconsin,54552,,NRS COMMUNITY DEVELOPMENT FEDERAL CREDIT UNIIONNRS COMMUNITY DEVELOPMENT FEDERAL CREDIT UNIION,P O Box 130520,Birmingham,Alabama,35213,,NUEVA ESPERANZA COMMUNITY CREDIT UNIONNUEVA ESPERANZA COMMUNITY CREDIT UNION,1232 Broadway St,Toledo,Ohio,43609,,NUSENDA CREDIT UNIONNUSENDA CREDIT UNION,PO Box 8530,Albuquerque,New Mexico,87198,,NUTMEG STATE FINANCIAL CREDIT UNIONNUTMEG STATE FINANCIAL CREDIT UNION,521 Cromwell Avenue,Rocky Hill,Connecticut,6067,,OMNI COMMUNITY CREDIT UNIONOMNI COMMUNITY CREDIT UNION,3141 Capital Ave SW  PO Box 1537,Battle Creek,Michigan,49016,,ONE DETROIT CREDIT UNIONONE DETROIT CREDIT UNION,630 Howard Street,Detroit,Michigan,48226,,ONE SOURCE FEDERAL CREDIT UNIONONE SOURCE FEDERAL CREDIT UNION,8870 GAZELLE,EL PASO,Texas,79925,,OPPORTUNITIES CREDIT UNIONOPPORTUNITIES CREDIT UNION,"25 WINOOSKI FALLS WAY, SUITE 203  P.O. BOX 67",Winooski,Vermont,5404,,ORION FEDERAL CREDIT UNIONORION FEDERAL CREDIT UNION,7845 Hwy 64,Memphis,Tennessee,38133,,OSWEGO COUNTY FEDERAL CREDIT UNIONOSWEGO COUNTY FEDERAL CREDIT UNION,90 East Bridge Street,Oswego,New York,13126,,OZARK FEDERAL CREDIT UNIONOZARK FEDERAL CREDIT UNION,2438 Katy Lane,Poplar Bluff,Missouri,63901,,PACIFIC CREST FEDERAL CREDIT UNIONPACIFIC CREST FEDERAL CREDIT UNION,2972 Washburn Way,Klamath Falls,Oregon,97603,,PANHANDLE EDUCATORS FEDERAL CREDIT UNIONPANHANDLE EDUCATORS FEDERAL CREDIT UNION,2718 Highway 77,Panama City,Florida,32405,,PARK MANOR CHRISTIAN CHURCH CREDIT UNIONPARK MANOR CHRISTIAN CHURCH CREDIT UNION,600 East 73rd Street,Chicago,Illinois,60619,,PATTERSON FEDERAL CREDIT UNIONPATTERSON FEDERAL CREDIT UNION,124 WP Malone Dr,Arkadelphia,Arkansas,71923,,PEACH STATE FEDERAL CREDIT UNIONPEACH STATE FEDERAL CREDIT UNION,1505 Lakes Parkway  Suite 100,Lawrenceville,Georgia,30043,,PELICAN STATE CREDIT UNIONPELICAN STATE CREDIT UNION,3232 South Sherwood Forest Blvd,Baton Rouge,Louisiana,70816,,PENINSULA COMMUNITY FEDERAL CREDIT UNIONPENINSULA COMMUNITY FEDERAL CREDIT UNION,521 W Railroad Avenue,Shelton,Washington,98584,,PHENIX PRIDE FEDERAL CREDIT UNIONPHENIX PRIDE FEDERAL CREDIT UNION,1810 Opelika Road,Phenix City,Alabama,36867,,POINT WEST CREDIT UNIONPOINT WEST CREDIT UNION,718 NE 12th Ave,Portland,Oregon,97232,,PRIORITY CREDIT UNIONPRIORITY CREDIT UNION,301 East Michigan Street,Orlando,Florida,32806,,PROFINANCE FEDERAL CREDIT UNIONPROFINANCE FEDERAL CREDIT UNION,7700 Broadway,Merrillville,Indiana,46410,,PROMISE CREDIT UNIONPROMISE CREDIT UNION,6500 Rookin St  Suite 109-C,Houston,Texas,77074,,PUBLIC SERVICE CREDIT UNIONPUBLIC SERVICE CREDIT UNION,7665 Merriman Road,Romulus,Michigan,48174,,PYRAMID FEDERAL CREDIT UNIONPYRAMID FEDERAL CREDIT UNION,PO Box 12100,Tucson,Arizona,85732,,QUEENS CLUSTER FEDERAL CREDIT UNIONQUEENS CLUSTER FEDERAL CREDIT UNION,127 Engineers Drive,Hicksville,New York,11801,,RAPIDES FEDERAL CREDIT UNIONRAPIDES FEDERAL CREDIT UNION,612 Broadway Avenue,Alexandria,Louisiana,71302,,RED RIVER MILL EMPLOYEES FCURED RIVER MILL EMPLOYEES FCU,256 Highway 3175,Natchitoches,Louisiana,71457,,REGIONAL FEDERAL CREDIT UNIONREGIONAL FEDERAL CREDIT UNION,7144 Kennedy Avenue,Hammond,Indiana,46323,,RESOURCE ONE CREDIT UNIONRESOURCE ONE CREDIT UNION,P.O. BOX 660077,Dallas,Texas,75266,,RGV CREDIT UNIONRGV CREDIT UNION,1221 Morgan Blvd.,Harlingen,Texas,78550,,RICHMOND HERITAGE FEDERAL CREDIT UNIONRICHMOND HERITAGE FEDERAL CREDIT UNION,50 West Commerce Road,Richmond,Virginia,23224,,RIO GRANDE CREDIT UNIONRIO GRANDE CREDIT UNION,301 Rio Bravo Boulevard SE,Albuquerque,New Mexico,87105,,RIVER REGION CREDIT UNIONRIVER REGION CREDIT UNION,3124 W. Edgewood,Jefferson City,Missouri,65109,,RIVERWAYS FEDERAL CREDIT UNIONRIVERWAYS FEDERAL CREDIT UNION,1012 Forum Drive,Rolla,Missouri,65401,,ROYAL CREDIT UNIONROYAL CREDIT UNION,200 Riverfront Terrace,Eau Claire,Wisconsin,54703,,SANTA ANA FCUSANTA ANA FCU,800 W Santa Ana Blvd,Santa Ana,California,92701,,SANTA CRUZ COMMUNITY CREDIT UNIONSANTA CRUZ COMMUNITY CREDIT UNION,324 Front Street,Santa Cruz,California,95060,,SCE FCUSCE FCU,12701 Schabarum Avenue,Irwindale,California,91706,,SEASONS FEDERAL CREDIT UNIONSEASONS FEDERAL CREDIT UNION,524 South Main Street,Middletown,Connecticut,6457,,SEATTLE METROPOLITAN CREDIT UNIONSEATTLE METROPOLITAN CREDIT UNION,801 3rd Ave,Seattle,Washington,98104,,SECURITY CREDIT UNIONSECURITY CREDIT UNION,3801 W. Boulevard Drive P.O. Box 5160,Flint,Michigan,48505,,SELCO COMMUNITY CREDIT UNIONSELCO COMMUNITY CREDIT UNION,1050 High Street,Eugene,Oregon,97401,,SELECT FEDERAL CREDIT UNIONSELECT FEDERAL CREDIT UNION,1914 N IH 35,SAN ANTONIO,Texas,78208,,SELF-HELP CREDIT UNIONSELF-HELP CREDIT UNION,301 W Main St,Durham,North Carolina,27701,,SELF-HELP FEDERAL CREDIT UNIONSELF-HELP FEDERAL CREDIT UNION,301 W. Main St.,Durham,North Carolina,27701,,SENTINEL FEDERAL CREDIT UNIONSENTINEL FEDERAL CREDIT UNION,4011 Triple Crown Drive,Rapid City,South Dakota,57701,,SHUFORD FEDERAL CREDIT UNIONSHUFORD FEDERAL CREDIT UNION,882 16th St NE,Hickory,North Carolina,28601,,SISKIYOU CENTRAL CREDIT UNIONSISKIYOU CENTRAL CREDIT UNION,845 4th St.,Yreka,California,96097,,SMART CHOICESOFTITE COMMUNITY FEDERAL CREDIT UNION,1201 S ZANE HIGHWAY,MARTINS FERRY,Ohio,43935,,SOFTITE COMMUNITY FEDERAL CREDIT UNIONSOUTH CENTRAL MISSOURI CREDIT UNION,901 East Main Street,Willow Springs,Missouri,65793,,SOUTH CENTRAL MISSOURI CREDIT UNIONSOUTH SIDE COMMUNITY FEDERAL CREDIT UNION,5401 S. Wentworth Ave.  Suite 25,Chicago,Illinois,60609,,SOUTH SIDE COMMUNITY FEDERAL CREDIT UNIONSOUTHEAST FEDERAL CREDIT UNION,665 Historic Hwy 441,Cornelia,Georgia,30531,merged with peach state fcu,SOUTHERN CHAUTAUQUA FEDERAL CREDIT UNIONSOUTHERN CHAUTAUQUA FEDERAL CREDIT UNION,168 E Fairmount Avenue,Lakewood,New York,14750,,SOUTHWEST 66 CREDIT UNIONSOUTHWEST 66 CREDIT UNION,P.O. Box 12010,Odessa,Texas,79768,,ST. LOUIS COMMUNITY CREDIT UNIONST. LOUIS COMMUNITY CREDIT UNION,3651 Forest Park,St. Louis,Missouri,63108,,ST. MARK CREDIT UNIONST. MARK CREDIT UNION,8441 S St. Lawrence Avenue,Chicago,Illinois,60619,,STRAITS AREA FEDERAL CREDIT UNIONSTRAITS AREA FEDERAL CREDIT UNION,201 Locust Street,Cheboygan,Michigan,49721,,SUNCOAST CREDIT UNIONSUNCOAST CREDIT UNION,P. O. Box 11904  6801 E Hillsborough Avenue,Tampa,Florida,33680,,SYRACUSE COOPERATIVE FEDERAL CREDIT UNIONSUSSEX COUNTY FCU,1941 Bridgeville Highway  PO Box 1800,Seaford,Delaware,19973,,TALLAHASSEE LEON FEDERAL CREDIT UNIONSYRACUSE COOPERATIVE FEDERAL CREDIT UNION,723 Westcott Street,Syracuse,New York,13210,,TAMPA BAY FEDERAL CREDIT UNIONTALLAHASSEE LEON FEDERAL CREDIT UNION,1827 Capital Cir NE,"Tallahassee,",Florida,32308,,TEXAS BAY AREA CREDIT UNIONTAMPA BAY FEDERAL CREDIT UNION,3815 N. Nebraska Avenue,Tampa,Florida,33603,,TEXAS COMMUNITY FEDERAL CREDIT UNION