cu_name,address1,city,state,zipcode,new_name,cu_nameTEXAS BAY AREA CREDIT UNION,12611 Fuqua St,Houston,Texas,77034,,THE FINEST FEDERAL CREDIT UNIONTEXAS COMMUNITY FEDERAL CREDIT UNION,605 E Caesar,Kingsville,Texas,78363,,THE FOCUS FEDERAL CREDIT UNIONTHE FINEST FEDERAL CREDIT UNION,59 Maiden Lane Lobby,New York,New York,10038,,THE NEW ORLEANS FIREMENS FEDERAL CREDIT UNIONTHE FOCUS FEDERAL CREDIT UNION,420 N. E. 10th Street,Oklahoma City,Oklahoma,73104,,THE UNITED FEDERAL CREDIT UNIONTHE NEW ORLEANS FIREMENS FEDERAL CREDIT UNION,4401 W Napoleon Ave,Metairie,Louisiana,70001,,tidemarkTHE UNITED FEDERAL CREDIT UNION,3 Sunset Beach Road,Morgantown,West Virginia,26508,,TINKER FEDERAL CREDIT UNIONTINKER FEDERAL CREDIT UNION,P.O. Box 45750,Tinker AFB,Oklahoma,73145,,TOLEDO URBAN FEDERAL CREDIT UNIONTOLEDO URBAN FEDERAL CREDIT UNION,1441 Dorr Street,Toledo,Ohio,43607,,TONGASS FEDERAL CREDIT UNIONTONGASS FEDERAL CREDIT UNION,Tongass Federal Credit Union  2000 Tongass Avenue,Ketchikan,Alaska,99901,,TOTAL CHOICE FEDERAL CREDIT UNIONTOTAL CHOICE FEDERAL CREDIT UNION,14963 RIVER RD,HAHNVILLE,Louisiana,70057,,TRAILHEAD FEDERAL CREDIT UNIONTRAILHEAD FEDERAL CREDIT UNION,221 NW Second Ave,Portland,Oregon,97209,,TRAVIS CREDIT UNIONTRAVIS CREDIT UNION,1 Travis Way,Vacaville,California,95687,,TROUVAILLE FEDERAL CREDIT UNIONTROUVAILLE FEDERAL CREDIT UNION,4700 Wissahickon Ave,Philadelphia,Pennsylvania,19144,,TRUST FEDERAL CREDIT UNIONTRUST FEDERAL CREDIT UNION,P.O. Box 4751  1 Fountain Square Lobby,Chattanooga,Tennessee,37405,,TUCOEMAS FEDERAL CREDIT UNIONTUCOEMAS FEDERAL CREDIT UNION,PO BOX 5011,VISALIA,California,93278,,TUSCALOOSA CREDIT UNIONTUSCALOOSA CREDIT UNION,1100 21st Avenue,Tuscaloosa,Alabama,35401,,UBC FCUUNIFIED HOMEOWNERS OF ILLINOIS FCU,4464 N. MILWAUKEE AVE.,CHICAGO,Illinois,60630,,UNIFIED HOMEOWNERS OF ILLINOIS FCUUNION BAPTIST CHURCH FCU,2200 Smith Street,Fort Wayne,Indiana,46803,,UNION BAPTIST CHURCH FCUUNITE BURLINGTON CREDIT UNION,1547 South Broadway,St. Louis,Missouri,63104,,UNITED CONSUMERS CREDIT UNIONUNITED CONSUMERS CREDIT UNION,1111 East 23rd Street,Independence,Missouri,64055,,UNITED CREDIT UNIONUNITED CREDIT UNION,802 East Breckenridge,Mexico,Missouri,65265,,UNIVERSITY OF LOUISIANA FEDERAL CREDIT UNIONUNIVERSITY OF LOUISIANA FEDERAL CREDIT UNION,619 McKinley Street  Suite 101,Lafayette,Louisiana,70503,,UNO FEDERAL CREDIT UNIONUNO FEDERAL CREDIT UNION,UNIVERSITY OF NEW ORLEANS  2000 LAKESHORE DR,NEW ORLEANS,Louisiana,70148,,UPSTATE FCUUPSTATE FCU,1303 N Murray Ave,Anderson,South Carolina,29625,,US COMMUNITY CREDIT UNIONUS COMMUNITY CREDIT UNION,2622 Old Lebanon Rd,Nashville,Tennessee,37214,,VERIDIAN CREDIT UNIONVERIDIAN CREDIT UNION,1827 Ansborough Avenue  PO Box 6000,Waterloo,Iowa,50701,,VISION FINANCIAL FCUVISION FINANCIAL FCU,214 Pacific Ave,Durham,North Carolina,27704,,VOCAL CREDIT UNIONVOCAL CREDIT UNION,2910 Prospect Avenue,Helena,Montana,59601,,WAYNE WESTLAND FEDERAL CREDIT UNIONWAYNE WESTLAND FEDERAL CREDIT UNION,500 S. Wayne Road,Westland,Michigan,48186,,WHITE EARTH RESERVATION FEDERAL CREDIT UNIONWHITE EARTH RESERVATION FEDERAL CREDIT UNION,785 Hwy 59 S P.O. Box 360,Mahnomen,Minnesota,56557,,WJC FEDERAL CREDIT UNIONWJC FEDERAL CREDIT UNION,P.O Box 841,Damascus,Virginia,24236,,WORKERS CREDIT UNIONWORKERS CREDIT UNION,815 Main Street,Fitchburg,Massachusetts,1420,,YS FEDERAL CREDIT UNIONYS FEDERAL CREDIT UNION,217 xenia ave,yellow springs,Ohio,45387,,